participant_id,task_num,word_count,time_spent,response,openai_score,qwen_score,xai_score
70,5,127,250,"I was working as a project manager for a small IT company in Mombasa, Kenya. The company had acquired a new client - a famous politician who wanted to create a system to conduct political polling. As the project manager it was my role to keep the client updated and make sure the developing team meets the required milestones on time. However, this client kept on calling asking for updates every hour and changed requirements at least two times a day. After noticing the trend, I created a Kanban board that was accessible by the client where he could monitor progress in real time. And I advised the client that he should note down all his changes and we will batch them up in the next update.",28,28,35
72,1,100,233,"I recently started a new job, full-time ith benefits. I always thought my depression would lessen with finally making a proper income, but it has only worsened. That this is my life now and will be for the next several decades. I can't breathe all weekday and the weekend is wrought with anxiety for the coming week, It's not that this job is not the right fit for me. It's simply any job and working that is the problem. I certainly can't stand my depression for much longer. I'm hoping for it to all end in the next couple years.",20,12,25
72,2,108,240,"I recently rewatched Dancer In The Dark and enjoyed it even more this time. It redefined the musical genre by making it a tragedy instead of the happy-go-lucky song and dance we're all familiar with when it comes to musicals. The main character resonated with as someone who used to work hard manual labour jobs and escape life through music and movies. I believe bad things happen to good people and there is no rhyme or reason to it. The fate of the protagonist illustrates this and made me feel less alone. The soundtrack was excellent, especially the one ""I've seen it all"" by Bjork and Thom Yorke.",20,25,28
72,3,100,232,"Anyone can write a book because all you need it pencil and paper, but very few people can create a movie.They can write a screenplay or be an actor, but they can't actually create a movie form scratch. My business idea would be to let people have a hub where they can submit their movie ideas or screenplays and they get matched up with actors and an entire crew willing to bring this story to life. We need more indie voices who don't get funding otherwise and their art deserves to be out there in the world like mainstream directors",32,32,38
72,5,101,278,I had to find a way to meet multiple deadlines at my previous part-time job while  also juggling life as a full-time university student. It was a chocolate shop so it was busiest during the month of December which also coincided with my final exams. What I did was create an Excel spreadsheet of all the tasks I needed to get done during this time. Both a traditional to-do list as well as a gantt chart to see how far I've come in each task and what still needed to be done. It helped me visualize everything and manage competing deadlines.,18,15,15
75,1,17,59,today I was sitting back watching a movie when all the sudden I received a phone call,15,15,15
75,2,64,192,I have eaten at a new restaurant chain that had been around for a long time but just finally came to my neighborhood it was delicious and I would definitely go back again or recommend it to any of my friends or family they were just normal chicken sandwiches but they were so delicious for some reason and I can't wait to go back,15,12,12
75,3,58,128,today I had a new idea to start a widget business but I'm looking for investors to help me with bringing my idea to life will you please help me it will definitely be in your benefit in the long run thank you for your time I look forward to hearing back from you in the near future,12,10,10
75,5,48,100,last week many people were laid off at my work but I wasn't one of them luckily but instead of waiting for my time to come I went on a job interview for a new job I received the job and now I feel I'm more stable overall,18,15,15
76,1,108,360,"Since the start of this year, my every day has been normal and energetic. However, last week during my visit at the national park with my friends at work, we all agreed to camp for an extra day. During the last night is when I had the most unforgettable night. We were seated outside when I watched the Milky Way stretch across the sky. For a moment I felt like I was floating in a cosmic ocean. My friends a I were happy for the get together and having to experience mesmerizing moments together. It was such as blessing to experience the night of such great history!

#Stargazing#NatureLover#NaturalMagic",28,25,30
76,2,104,360,"During my recent visit to my friends place in town, I tried a new pizzeria, which was crispy crust and had vibrant toppings. It was on a Saturday evening when we were watching football at a local meeting point. We we there so we orders 3 pizzas and drinks to keep us energized for the next two hours. My friends had no prior experience nor taste with this new type of pizza. I had heard of it from my workmate who had tried it late last week after going home late from work. The Margherita pizza was a Pepperoni Inferno, meaning sweet. Try it!",15,15,15
76,3,119,356,I have always been a support of renewable energy since it helps us live sustainably and conserve our environment. My dream business is setting up a solar-powered smart household appliances store in our community. The store will use renewable energy and sell products that operate and consume renewable energy as well. An example of a product I would like to sell is solar panels like the ones I will be using at my store. I will serve as an example and a leader by using solar panels and selling them to people after confirming their value by leading as an example. We have to conserve our environment as we conduct business for a better tomorrow and generations to come!,20,15,20
76,5,124,343,"I have been a team leader and a supervisor for the last 2 years. During a major project with my team last year, one of the team member was cornered by a tight deadline which caused have affected the results of every other member of the team. Since I was in charge of the project, I had to seek help from other team members to assist regarding the tight deadline. I used strategies such as rescheduling tasks and their timelines to stabilize our team's progress. Finally we helped the struggling member of our team and we managed to comfortably beat the deadlines for the whole project. We received our congratulations and we are aiming for higher next year, as well as expanding our team.",15,15,15
77,1,53,359,"I was in a meeting at work and at the end of the meeting, one of my coworkers introduced a quick game to the rest of the team.She said the name of the game was called Mad Lib. So basically because we had such a large group of people, we had to in",20,15,15
77,2,119,160,"The last movie I watched that I was excited to see was called Final Destination Bloodlines.So It is a pretty well known line of movies and I felt like this might really be the final one so I was anxious to see it. I will definitely say that it was one of the better ones. In my opinion, the first one was the best before I watched Bloodlines. While, I do think there was definitely room for improvement, I would say it was an overall successful movie to end the series. I also liked the emotional touch added with one of the recurring characters. It tied in with something that was going on with that character in real life.",18,15,15
77,3,100,152,"My dream business would be an interior design type of business. Basically I would create pieces that can be purchased to decorate the home. I would want to create artwork for walls, decals, throw pillows, lamps, and floral arrangements. The biggest thing that has stopped me from doing that is the massive amount of money it would take to bring my ideas to life. I have the design ideas but you also have to have a place that can create those designs,keep it under budget so it is affordable, and finding the space for a store that is not expensive.",18,15,15
77,5,104,298,"A significant challenge that I faced was finishing college as an adult. I went about things in a very non-conventional way after high school. It made it a lot more difficult when I decided I not only needed to but wanted to finish college. I found that determination was not the only thing that got me through. I had to use skills like time management, creating a routine and sticking to it, and making very short term goals to make my long term goal seem more accessible. I feel that the skills I used could also be used to be successful in the job.",20,15,15
81,1,127,223,"I never expected a quick coffee run to turn into such a memorable experience. Walking into this cosy little cafe, the smell of fresh pastries instantly made me feel at home. As I waited for my drink, I struck up a conversation with the barista, who shared some of the most amazing travel stories I've ever heard, places I'd only dreamed of visiting. It was one of those small moments that remind you how much connection can happen in the most unexpected places. Sometimes, the best adventures start when you least expect them. Definitely grateful for that little detour today! Moments like these remind me to stay open to new experiences, because you never know when a simple coffee run might turn into a story worth telling.",24,25,30
81,2,149,176,"I recently tried The Green Spoon, a cosy little spot that's been getting a lot of buzz for it's fresh, farm to table menu. From the moment I walked in, I loved the warm, inviting vibe, perfect for a casual dinner or catching up with friends. I ordered their signature roasted vegetable bowl, and wow, the flavours were incredible. The veggies were perfectly cooked, and the tahini dressing added just the right amount of creaminess without overpowering anything. The portion was generous, too, which I appreciated. On the downside, the wait time was a bit longer than I expected, and the dessert menu was limited. But honestly, the quality of the food made up for it. If you're into fresh, wholesome meals with a creative twist, The Green Spoon is definitely worth a visit. Just come prepared to savour every bite, and maybe bring a book while you wait.",24,15,25
81,3,106,176,"Hi, I'm launching 'Global Roots', a plant based meal prep service inspired by international cuisines. I've always loved cooking and exploring global flavours, and with my background in marketing, I know how to reach niche audiences who crave both health and variety. Each week, we'll offer rotating menus, think Moroccan tagines, Thai curries, and Caribbean stews, made entirely from plant based, whole ingredients. It's not just about food, it's about culture, sustainability, and convenience. With a $10,000 investment, I'll scale up production, streamline packaging, and launch a targeted digital campaign. There's a growing demand for healthy, global, and ethical food, and I'm ready to meet it.",28,25,35
81,5,98,222,"When I moved to a new city for my first job, I didn't know anyone and felt completely out of place. The pace was fast, and I doubted myself a lot in the beginning. Instead of staying stuck, I pushed myself to connect with co-workers, asked for feedback, and found a mentor who really helped me adjust. I started volunteering for projects and slowly built confidence. Within six months, I led a team project and felt like I truly belonged. That experience taught me how to stay open, even when things feel uncomfortable, it's usually where growth starts.",20,15,25
82,1,97,349,"Out of nowhere we went to a party and to an unexpected casino visit, It was a casual party at a friend's birthday until one of the guys we met had the urge to go. A lot of the guys also had the urge to go so we all in unison agreed and went to the casino despite the drive to the casino being an hour and a half. We all had fun as we rooted for each other to hit it big. It truly was an exhilarating experience and would like to experience more unexpected adventures.",24,25,25
82,2,154,357,"Recently I got the opportunity to watch the latest Superman movie directed by James Gunn. Before the movie's release there was a lot of controversy in replacing Henry Cavil as superman, but the reason was because the DC universe was going through a reboot. Eitherways this movie had a lot of skepticism and I was as well until I watched it. The movie itself is great. The actor who plays Superman does a great job in portraying the character that I can not blame James Gunn for choosing this actor. They fit the role perfectly. Lex Luther was  a big threat in this movie and he was childishly menacing. His power and authority over people really made him menacing. Green Lantern was a surprise as his character was great as well, he is a loveable funny hero. The plot in itself is generic but its executed greatly. I would give this rating a 10/10.",20,25,15
82,3,143,356,"I have a dream of creating one of the best arcade's in the city. Arcades were relatively popular back in the 90s and early 2000s, but with time they faded out. However teenagers and young adults love these arcades and never hated them. However if we were to create an arcade that focused not only an old aesthetic as old arcades but also contained newer games and featured the ability to console titles within the arcade. This would make for an easy way to demo a game while also having the experience to do practically anything. The arcade should also contain a little store where you can buy food and drinks at a small venue so the people don't leave and have to come back for more. The arcade will only have an entrance fee while keeping all the content free to play.",24,25,28
82,5,178,358,"Unironically enough one of the most challenging aspects I had to face is when I had to do a presentation for an EXPO. The presentation consisted of a fictional company but the audience was real and I had to present for a solid 20 minutes. Because I'm an introverted person and I was no social this was a heavy task. At the time I've never done such a big presentation yet do one for 20 mins. I had to maintain a lot of composure and keep track of the things i talked about. What I ended up doing was making a powerpoint where it hardly contained any words, that way the audience had to focus on me where they would get most of their information. This was for the best for me as I saw this a great opportunity for growth. Overall I practiced with a couple of people until the day of the EXPO. The presentation was a great success as I managed to get third place out of more than 50 expos that were being done.",24,25,20
83,1,101,342,"Who knew that purchasing something from the past could lead to luck in the present and future. I purchased an old postcard from an online auction, my cursor landed specifically on it. Normally, they all sell within the second, so this was fate. Once it arrived in the mail my luck changed that week. I went from the mundane to the exceptional. It was a powerful talisman of good luck. I saw sharper performance at work, even more meaningful interactions with friends, and enhanced stamina during my workouts. There wasn't anything I couldn't accomplish, thanks to that treasure from the past.",36,32,38
83,2,100,345,"A morning to remember, from the mountains of Sweden to my breakfast plate in Canada, Lingonberry jam provided me a wonderful surprise. I first had this on my toast this week after discovering it in the international section of my local grocery store. Rich in antioxidants and rich in flavour, without being rich in price, this jam provides taste and health benefits in every spoonful. The taste is very similar to cranberries, though it is less tart. It spreads easily and is packed with vitamin C. A very unique way to start the day, sweet and savory, full of utility.",28,25,35
83,3,68,271,"Imagine owning a slice of history, an asset that not only appreciates in value, but also tells a story. Show your personality and enjoy growth in a booming untapped market. Explore the extraordinary, this is your chance. Led by a team of seasoned experts in various collectibles and antique categories, inveest with confidence. Diversify your standard porfolio with something tangible and timeless. This is where passion meets investment.",20,25,25
83,5,119,300,"When tasked with finding research for a work project to support a prison program we were drafting. I encountered a significant challenge. The article that provided the best data to support the proposed program was only available in Norweigan. Despite, not knowing the language, I leveraged AI tools to overcome this barrier. First, I used the AI to translate a draft email in Norwegian to the researchers. This approach proved successful and they provided me with a full copy of the original article. The problem however is that it was still in Norwegian. From there I employed the AI tool to translate the entire document into English, ensuring that our draft program had the proper evidence to support it.",30,25,35
85,1,100,296,"I celebrated my 50th birthday a couple of months ago! It was such a milestone for me :) 
Family and closest friends were there and it was the best experience ever. I've never felt so loved. We laughed, reminisced, and created new memories that I'll cherish forever, and it was truly a night to remember. We went to our favorite steakhouse and bar. There was laughter, music, and dancing, and everybody had fun in this joyous occasion. The heartfelt toasts and the wonderful surprise cake at the end made the night truly unforgettable. Here's to another 50 years of love!",20,25,20
85,2,101,196,"My husband and I took our young kids to see the live action remake of How To Train Your Dragon. We already loved the animated movies that came before, and we were so excited with this live action remake. I bought tickets for everyone a few weeks in advance because we always like to pick the best time in the schedule. Guess what? The movie was spectacular! It never disappointed! The cast, the visual effects, how they stayed true to the original animated film -- everything was perfect. The kids loved it so much and we can't wait for the sequel!",18,12,15
85,5,135,293,"A significant challenge I've faced was when I gave up my job to start a family. I have worked so hard for many years and I took care of my family. This has always how I defined my life -- being able to be independent and career-oriented and chase after my dreams. Everything changed when I got pregnant with my first child. The idea of raising a young child while still fulfilling major work responsibilities seemed easy enough, in theory, but I thought really hard about it, and I decided that I would want to devote all my time and effort to raising my child first before I go back to the work force. This has enabled me to clearly focus on priorities and identifying which aspects of my life are more important than others.",20,25,20
86,1,94,359,"With little training and not feeling ready, i did the midnight marathon and still beat last years's time. That shows sheer determination can push you through and the body is capable of more than you know! The cool night air was the push i need to drag me through as the heat of the day had been too much and would have been too intense! Every step closer to the end was satisfying and knowing I had to done it to make a change, made crossing the line a sweet momment.  #mensmentalhealth #personalbest #marathon",26,28,35
86,2,93,360,"Stepping into the bustling embrace of our local indian restaurant felt like entering a warm, aromatic haven it was perfect for a family birthday celebration! It was a little wait to get seated as it was so busy!(A good sign), out anticipation was palpable! For starters we ordered a mixed grill and washed it down with a beer, the hot plate was sizzling with succulent lamb chops, chicken Tikka and crispy fish pakoras. We then had a the main course with a hot butter chicken and naan bread, this was second to none",20,15,15
86,3,60,360,"Introducing RunMind: Where every step empowers your mind. 

Join a community where running isn't just about pace or distance, it's about presence. We want to transform your run into a journey of mental wellness, blending guided mindfulness runs with expert mental health support. 

So lace up, log in and let every mile be a step towards a healthier, happier you!",32,32,38
86,5,144,360,"One of the most significant challenges I have faced was training for a full marathon which started at midnight. I took on to fundraise for men's mental health awareness. It sounded like a great idea at first to do something so meaningful and get fit at the same time. Once the training started I had to balance early or late runs with a full day of work and family duties. This was a display of my own mental health challenges. How I overcame this was to build a structure, breaking the training into manageable goals, tracking progress and leaning on a batch of others doing the same thing as me. Once i crossed the finish line it was one of the proudest moments of my life, not just a physical achievement, but also reminded me what's possible with discipline, teamwork and a clear ""why""",34,28,35
87,1,45,90,"Went to Stray Kids concert in London , and wow, what a night! They sang and danced their hearts out for three epic hours in the stadium - pure energy and talent. Still buzzing from the incredible vibes and can't wait for theit next show!",20,25,20
87,3,58,214,"Introducing 'AI HeartMatch', a revolutionary dating app that uses advanced AI algorithms to analyze personality traits, interests, and communication styles, ensuring users are matched with partners who truly share their values and qualities. With your $10000 investment, we will enhance our AI technology to deliver highly compatible matches, fostering meaningful and lasting connections in the digital dating world.",20,15,35
87,5,80,226,"Facing a tight deadline, our supplier informed us they could not deliver the uniforms for our event on time. With limited time, I quickly devised a solution. I purchased 46 identical T-shirts from Primark that matched our brand colors and paired them with branded lanyards we already had. This quick pivot ensured our team manintained a cohesive look for the event. The attendees did not notice the change, and it highlighted my ability to adapt and make swift, effective decisions.",20,25,25
88,1,103,304,"Just spent the most magical morning in a flower picking meadow with my teenage daughters! watching them weave through the vibrant and fragrant blooms, laughter echoing under the sun was pure bliss. Their eyes lit up brighter than the wildflowers, and our vases overflowed with both petals and precious moments. Can't wait to turn these blooms into memories that will last a lifetime! Sometimes the simplest moments make the best memories. Here is to more spontaneous adventures and the joy of watching my girls blossom into beautiful young women who shine brightly like these flowers. #flowerpower #Familytime #Bloomingmemories #petalpatch #poppies #flowers #Flowerpress #daughters",28,25,35
88,2,104,310,"Our family celebration at Meze in Hull was a delightful experience, with a feast of flavours that didn't break the bank. the service was top notch, making us feel like VIPs and the delicious dishes made every moment a joy to savour! The Mousaka was a standout dish, with it's rich layers and authentic flavour it transported us to the heart of Turkey. The dips were equally impressive, bursting with fresh ingredients and vibrant flavours that perfectly complemented our meal. If you're in Hull and craving a slice of Turkish delight, Meze is the place to turn your ordinary night into a culinary celebration.",20,15,35
88,3,68,359,"Invest in NatureQuest Academy, where young adventurers embark on exciting journeys to explore the wonders of the world around them. Rooted in the UK's Early Years Framework we transform forests, beaches and parks into interactive learning playgrounds that ignite curiosity and essential skill like teamwork, problem solving nd creativity. Your $10,000 investment will mepower us to inspire more children allowing them to say, ""We learned with the tree",32,35,38
88,5,103,264,"In a recent encounter with a particularly frustrated customer, I listened attentively to understand their concerns and make sure they felt heard and validated, this demonstrated empathy and patience. I acknowledged the issue and assured them of a solution, balancing their needs with our company's policies. By offering a suitable alternative and a small goodwill gesture I turned their experience around. this approach not only resolved their concern but also reinforced our commitment to customer satisfaction, ultimately strengthening their trust in our brand. My ability to maintain a calm demeanor is certainly a strength that I can take forward into this new role.",15,15,15
89,1,119,360,"Imagine stepping off a plane into a country where the sun is always sunning shades of gold and beaming shades of blue ocean. The Canary Islands are a magical secret that i got to discover recently on my first vacation in a long time to the sunny destination of Gran Canaria. I stepped off the rrelatively short flight into a gust of warm air, a big contrast to my home land of England. A smile instantly came to my face thinking of the next couple of weeks I was going to have with my family. I had brought my mum and my little sister here. We settled into our seaside hotel and mapped out where we wanted to explore",30,28,25
