participant_id,task_num,word_count,time_spent,response,openai_score,qwen_score,xai_score
4,1,42,264,"Check out whats ""Swinging into my collection with style!""  I just scored a Nic Cage signed Spider-Man Noir Funko! As my favorite actor, this keepsake from the upcoming TV show feels a lot like catching a rare comic book gem! #NicCage#SpiderMannoir #Fangoals",28,25,38
4,2,96,356,"If you're a big fan of things hot, and cheesy I would recommend the new Arby's Cheesesteak! Now i know what you're thinking ""Cheesesteak is so basic, its just meats, onions, cheese and peppers..."", but trust me this sandwich is a cut above the rest as it touts a secret weapon.  Garlic is possibly the last thing you'd expect to taste in a sandwich like this, but Arby's surprises your taste buds with a punch of savory garlic that makes this sandwich something special.   You need to experience the garlicky goodness yourself, you wont be disappointed!",24,25,35
4,3,88,314,"Today I am here to pitch to you why you should invest in my business; Mjolnir Collectibles, we hammer the competition!  We dabble in the collectable scene which means we buy, sell, and trade all sorts of collectables though mainly we tend to lean towards comics and funko pops! If you enjoy thrillseeking, such as rollercoasters then I am sure you'll love our company as you ride the wave of excitement of finding rare gems such as limited edition items, and items signed by celebraties from local conventions.",24,25,25
4,5,127,351,"Honestly every day is a significant challenge, and I think rising up and charging head first to deal with it showcases my endurance, and determination as a person.   Since a young age I have been diagnosed with Diabetes, meaning as an adult I have to pay close attention to my physical health and diet to get through the day which isnt exactly easy. I have to learn to adapt to new health practices, and technologies such as my insulin pump, and blood sugar monitor to get through the day. Not only this but I have to be adaptable to handle sudden random emergencies such as spontaneous highs and lows. I believe these daily life struggles help show how I can effectively handle work challenges, and demanding situations.",20,28,35
7,1,128,270,"I can't believe how much these two sweetheart have grown since we brought them home in April. It just seems like yesterday that we came home with them. Those forst few hours of having them were nerve wrecking, I really didn't think they would ever leave the cat box that we fetched them home in, but when they were brave enough to come out I was thrilled. Toby was the first to come out and explore and when she saw her nrother leave then Echo soon followed close behind. They were so nervous and scared but we kept telling them everything was ok and they didn't need to worry. Now I look at them climbing everywhere adn gettimng into all kinds of trouble and my heart just melts.",20,25,20
7,2,123,272,"I have recently watched Mobland and I would give it ten out of ten. The show is written and directed by Guy Ritchie and stars Tom Hardy, Pierce Brosnan and Helen Mirren and is based around a crime family and there pplace in the London gangster scene. Hardy is magnificent in his role as the family sorter outer and his on screen antics are superb. Mirren plays the wife of Brosnan and her magnificent acting style is a joy to watch as is Brosnan. One thign Guy Ritchie does well is take actors out of their comfort zone and gives them a role that they need to give their all to and every actor in this does that exceptionally well. I highly recommend.",20,15,15
7,3,181,360,"Today more than ever people are owning pets and the fact that pets can help with your mental health is one of the main reasons that people adopt cats and dogs. But owning a pet comes with it's own problems and stresses and while owning a pet can be very rewarding it can also make us worry about them. One worry is about leave your beloved cat at home while you go to work, because lets face it these little cuties aren't chep to care for so we have to go to work to be able to provide good care for our little fur babies. This is where I come in, I offer to come and either spend the day with your little one or pop in a few times a day to check that they are alright or I can arrange for someone to stay if you have to go on holiday. Each service will come at different but very reasonable prices and I can guarantee that they will be loved and cared for as if they were my own",20,25,25
7,5,197,360,"I have worked with people that have strugled to read and write and in my role as an adult tutor I had the pleasure of meeting a gentleman that had hidden the fact that he could not read or write and he had hidden this from his family and previous employer for years, He had managed to work his wqay up to a supervisor in hisd previous job but had recently been made redundant and that was when I met hm. He was very reluctant to let me help and got angry if I tried to help and one day he got very distressed and scared soome of the staff, by this time I had started to suspect that he had problems with reading and I managed to calm him down and asked to speak to him alone and that wa when he broke down and confessed. I assusred him tha he wasn't the first person to walk through the door that couldn't read and I assured him that I could help. We organised for him to come in weekly and do homework and within 6 months he was reading at a level he never thought possible.",24,25,25
8,1,10,359,"Today marks the begging of a love story, tow h",10,10,10
8,2,41,152,"I just finished watching moana 2, it was intresting but not as i expected, i thing it was a little over rated as i did not really get the story and the message i thiink i enloyed the part 1 better.",15,15,12
8,3,53,359,"from child hood  i have dreamed to becoming a doctor and my family was very poor and this dream seemed very far, this dream was more for my sick much as she was sick and not doctor will treat her because we could not afford it.  I reached that dream, i am now",15,10,10
8,5,43,160,My mum died when i was 15 and i have i little brother who was 12 and my dad was not very present i had to take the motherly responsiblity to take care of my brother and today was are grown and well.,15,15,20
9,1,152,237,"I think this story stands out. I was driving back to work, after running home for lunch and saw the most amusing and surprising site. A woman had stopped her car to assist a box tortoise that was trying to cross the road. This in of itself wasn't surprising. But the reaction of the tortoise was. It was scared. So scared it did was they do when scared. It proceeded to urinate. A lot. ALL over the woman. Now, the poor woman, shocked by this turn of events, yelled and threw the tortuise into the air. The poor Tortoise, scared again, proceeded to urinate again, now in mid air, and sprayed the woman even more, soaking her hair. The animal landed on the dirt, right side up, and immediately made for a patch of woods. The poor woman now covered with tortoise urine, stood there for a moment and began to laugh.",38,38,42
9,2,120,242,"The Pirates Grill is a humble establishment. It's small, and decorated in the most eclectic style. It's run by a husband and wife team. One is from Bulgaria and one is from the Ukraine. While that makes it interesting, what really stand out is the food. Eating here is like eating at your Grandma's house, if your Grandma had spent a life making food from Eastern Europe and the Med. Hummus to die for, kebabs that are full of flavor, insanely good shwarma, fantastic Borscht, and one of the best pieces of honey cake I've ever had. Service is mixed, as the couple do it all themselves, but the food is in fact... the star. It's worth the wait, everytime!",28,25,35
9,3,101,341,"To whom it may concern:
I'm writing you today to ask for an investment of 10,000$ in FormatAI a revolutionary AI agent that allows a self-published author to take a finished manuscript and with a single click transform the final draft to publishing ready formatting. Formatting a book is always a headache, and this tool allows authors to make it simple. More time writing, less time formatting. Offering authors a hassle-free experience across various formats and sizes, expanding their reach and maximising their creative potential. With your help, we can transform the self-publishing field, not in the future, but right now.",24,25,38
9,5,108,182,"What stands out to me was the 2008 financial crisis. I was working for a company that primarily was paid from state and federal contracts. Money was drying up everywhere and layoffs had started. While I was working in IT, we weren't immune from the cutbacks. Out of a team of 9, 4 people were laid off all at once. I was very thankful that I was spared the axe, but it made everything far more challenging. Everyone who was left had to pickup the workload, and there was a lot. We had to generate new procedures, new ways of doing everything. It was a VERY challenging time.",20,25,15
10,1,102,264,"What an unforgettable night watching The Script at Ludlow Castle - singing along, enjoying a few beers, and making memories with family. 

I want this to be a longer post than usual, weird for me, I know. 

It's good to do these things. I wasn't actually that keen! They were so much better than I imagined, and every song brought back special memories. I actually forgot that I knew so many songs! 

It was amazing to share that with my loved ones. The castle backdrop made it all feel magical, and all I want now is to do the same thing again!",28,25,30
10,2,103,178,"I recently watched the film called Speak No Evil, the English version of a Danish-language film. 

Wow. It was brilliant, exactly what a horror-drama should be. It was chilling, and I was on edge the whole time. The acting was brilliant, and it felt like a big must-watch film. 

James McAvoy is a great actor, and to be honest, that was one of the main reasons why I decided to watch this film. But it was actually much more than that. I think normally I have a good idea of what's going to happen, but I could not predict this one at all!",20,25,15
10,3,100,132,"Imagine a series of vibrant, casual coffee shops where the focus is purely on great coffee and great cakes, creating a cosy community place for socialising and relaxation. With your $10,000 investment, we can establish a unique, fun atmosphere that attracts coffee lovers and builds a loyal customer base, setting the stage for future growth and expansion. 

I've worked in coffee shops. I know what is needed to make them different, to make them work. Customers are so important, and making them come back regularly is the sign of a brilliant place. It would be amazing to do this together.",18,15,15
10,5,59,136,"I navigated a challenging work environment by maintaining professionalism and focusing on delivering high-quality work, which ultimately improved my working relationship with my boss. 

I think that bosses can sometimes be tricky people, sure, but the reason I stuck with it was because they are a human too. Everyone has flaws! We have to work together to overcome them.",20,15,15
11,1,94,269,"Hello travellers and adventure people. I recently went to a country in East Africa called Kenya. Well, I was expecting much but the trip was more than worth it. I visited the most popular wildlife tour called the Mara. And guess what its one of the seven wonders of the world this is because you get to see wild beasts cross from one side of the park to the other, crossing a flooded river and dangerously infested with crocodiles and other water beasts. Its a beautiful sight to see, you should check it out.",20,25,25
11,2,58,359,"Even if movies is not your cup of tea you will find this particular movie very captivating. Talk about the plot the actors the graphics, wow everything is just top notch. Honestly, its a thriller for me. It involves a group of high quality car drifters or you may say pro drivers. The movie name, FAST AND FURIO",15,15,12
11,3,54,350,"I want to start a production company specializing in high quality video content creation for brands, agencies and individuals. The services will include social media content creation, event videography, brand adverts,corporate video production and post production editing. Target market is business  and entreprenuers. We'll have state of the art equipment and a talented team",15,15,15
11,5,87,340,In my previous role I was working on a project with a tight deadline and we discovered a problem as we got closer to launch. The client was expecting delivery and not delivering would have cost our reputation and loss. I took the initiative to lead a brainstorming session with our team and identified the potential problems. We worked together even extra hours and got the job done by delegation of responsibilities and we were able to resolve the technical issue and deliver the project on time.,15,15,15
12,1,102,346,"Just got back from one of the most breathtaking hikes I have ever taken in my life. As I was walking the trails today, my breath was taken away by the amazing sites of the mountain tops and the thousand year old trees. The greenery was enchanting and the air was cool and crisp, the wind has never felt so good on my skin. This moment was so peaceful and left me so content. I will forever cherish and remember this amazing hike, I have never been left so breathless in my life and I can not wait to do this again.",20,15,25
12,2,137,334,"As I walked into the restaurant I was first met with amazing decor scattered around the restaurant. The vibes were amazing and it gave such an old timey feel. The walls were decorated in pictures from olden days and they had vintage items set up all over the place. The smells of fresh baked bread filled the air. We got seated fast and the server we had was very attentive. We order bacon and eggs and order one of their cinnamon rolls. The food came out super fast, however when I took a bite into this seemingly delicious food, I was met with a not so delicious taste. MEDIOCRE. Although the atmosphere was great, the food was not so much. I would recommend to come at least once, but I would never come back to eat again.",20,15,25
12,3,113,327,"Sourdough has always been a life long business dream. I started sourdough years ago when my passion for baking expanded. Over the years sourdough has risen in popularity and has gone viral all over the country. By just using flour, water and salt makes it appealing to many people because a lot of people are cutting out preservatives. By starting this business I would love to give people the opportunity to have a store front to buy their fresh baked breads whenever they want without having to wait for the farmers market every week. I really enjoy this bread, many people enjoy this bread and I think you would enjoy this bread to.",18,15,15
12,5,122,333,"A challenge I had to overcome was actually really recently. I had some issues arrive at work and they needed some help on how to over come the challenge. My company really needed a new website up and running fast. They had hired someone to do it and they had fallen through. This website needed to be up in 24 hours and they threw it at me and I was left to figure out how to get it done on time. With my time management skills and my ability to cope with high stress situations, I was able to overcome the challenge of having this website up in a short time and got it done exactly when it needed to get done.",20,15,15
13,1,139,307,"I'm always the teacher's pet, it's just my personality. While on vacation in the mountains I was able to visit a glass blowing presentation. True to my teacher's pet personality I asked many questions and maintained eye contact. The presenter engaged with me and to much shock invited me to help him during his presentation. I was able to hold the blow pole while he created ""a magical kitty with a long tail"" out of vibrantly glowing molten glass. We had some fun banter and then I suddenly heard a loud crack. My kitty was suddenly ""a magical kitty with a short tail."" I went back the next day to buy this magical kitty before he got melted down again because of his defective tail. He's sitting on my desk now reminding me of such a fun family event.",38,32,38
13,2,117,202,"Imagine yourself at work, you're sat in your squeaky office chair and your desk is full of clutter. Not a happy experience. This coffee table changes everything if you work from home. It lifts up so that your office chair is now your couch. You just extend your coffee table and work from the comfort of your living room. Kick your feet up and watch some tv or listen to some music while in between work tasks. This coffee table was easy to put together and looks great in my office, oops, I mean living room. It's sturdy and I think it will last a long time. The extra drawers and storage spaces are also extremely helpful.",24,25,35
13,3,111,360,"Here's my idea which may or may not be available but I believe it's a business for which there can be a lot of growth. An app that tracks all of your subscriptions across all platforms but with a twist. That twist is that it can also track your rewards memberships and any type of spending you want to control. You have full control over which content you want to monitor. It could have health tracking, subscription tracking, spending tracking and even track what groceries you have left in the fridge. The possibilities are endless and can reach all aspects of your life. All crammed into one easy to use app.",28,25,35
13,5,144,331,"A life experience that was challenging to me that I overcame was trying to learn how to be a teacher during covid lockdowns. I had three children at the time. One was starting elementary school, the other was starting high school(also first year of college, a special program in my area). The third was in diapers. I learned how to juggle all of these responsibilities and created special places in my house to designate as virtual classrooms. The dining room was the high school and the living room was the elementary school. I hung up fairy lights and curtains so the kids could stay focused. I'd bounce between the two ""schools"" while taking care of the toddler. Each day we'd take some time away from learning to do a ""daily happy."" For our daily happy we'd do a fun craft or activity each day.",32,25,38
14,1,100,357,Proud Parent Moment!  Eric has just broken the U21 archery record for the UK at last month's National Tour competition. We got the official confirmation today. I'm so proud of the work he has done this year to get to the top.  He has been working really hard with his coach but he's also spent loads of time in the gym building his strength so he can use a higher poundage bow.  Watching him grow in both skill and strength has been inspiring. Let's hear it for the champ!!  I'm so amazingly proud of him! #archery #archerychamp #amazing son yay!,20,15,25
14,2,110,281,"Big Wheels in York is my go-to for car services. They did my MOT recently and I found they were really trustworthy. It is run by Bruce. He is impressively honest and forthright. His clear communication about pricing and dedication to quality service make him a standout. Trust him for both routine and complex car repairs without hesitation. 
After I had the MOT, my second car developed a fault with the clutch. I was so relieved when Big Wheels expertly repaired my car's clutch. The job was done efficiently and at a great price, giving me peave of mind and proving their skill and reliability. Definitely a five star service!",18,12,15
14,3,109,328,"I'd love for you to invest in Brighter Horizons Play Hub. We are an innovative centre combining education and fun. We offer a blend of after-school tutoring and play activities at our centre.  As well as offering indoor play we have dedicated tutors teaching group and individual classes for 5-16 year olds. A ticket to play and learn will include a meal, one or two tutoring sessions, depending on age and ability and then an hour of play for 5-12 year olds. 12-16 year olds benefit from our community youth hub attached to the centre. Join me in shaping the future by fostering a love for learning and play.",24,25,28
14,5,110,321,"One of the most significant challenges I have faced recently is when I had a rental house. After our tenants left we needed to do some redecorating. The shower, unfortunately, required significant repairs. Even though I had no prior plumbing experience I decided to undertake this myself. I got kitted up with supplies from Screwfix and set to work myself in order to save time and money. I turned to YouTube tutorials and spent hours researching different creator's videos in order to learn how to do the repairs myself. I had a can-do attitude and a lot of confidence in myself. Amazingly I was able to fix the shower perfectly!",20,15,15
15,1,136,360,"You know when you are sitting around and spinning ideas around in your own head? That happened to me the other night. As I laid on the couch, where I sleep mind you, I began to contemplate the universe and reality, and I almost cried. I just could not understand how or why anything exists, Let's just skip all of the bullcrap and start at the Big Bang. it's obvious that from our point of view there's a loophole. What created the thing that created the Big Bang. Even if there was a single particle, what made the particle? how does any particle at it's smallest, create itself? Maybe there is no time, maybe there are no particles, maybe this is all some monkey hunt to understand things we cannot even perceive for what they are.",36,32,38
15,2,89,290,"Hello, My name is Kal-el. I recently saw a movie based on my life and I wanted to review it. Firstly, my parents aren't planet colonizing zealots. Secondly, If a man shhots an innocent man right in front of me, while also trying to poison me to death, when I escape, trust that I will stop at nothing to find that man and either throw him into space or bring him directly to the authorities. No messing around. Finally, I will not be babysitting my drunk cousin's untrained dog.",44,42,38
15,3,40,287,"So, we are living next to one big ole reactor? One that has been feeding our planet for 4.5 billion years, and we don't know how to use it? Join us in unlocking true potential, sustainable energy for another millennia.",30,42,38
15,5,99,264,"At most jobs, there is a cultural fallacy that telling the truth about an adverse situation will get someone else in trouble. Most employees do not understand that the goal of a root cause analysis is not to assert blame, but to analyze current systems and see if there are bottlenecks or things that can be improved. At my last job, we faced this issue many times. I suggested to management that we clearly define our culture through in-services and creating sayings and reminders to hang around the office of the importance and purpose of a root cause analysis.",28,25,20
16,1,120,335,"Last weekend I went to a ""fake festival"" with my friend Wendy - copies of favourite band, in a field, with drink and dancing. We'd been growing apart since she got a new boyfriend, and I get that she wants to spend time with him.  But, this was an important day for us, and I was anooyed when she left early to go to his. I stayed because I was having fun. I ended up winning a dance off! When I sent her the video she realised she'd been missing out.  She laughed at it a lot and decided we shoukd have more adventures together in the future. It's nice to know I am still a priority in her life.",32,25,35
16,2,177,282,"Recently, I wanted to change internet providers. I found a great price and booked an installation, but I was dubious that the equipment would arrive before the engineer, the turnaround time was so tight. 

I went online to find a number to call or an agent to talk to online, but I got stuck in a loop with a chatbot which did not understand my query, or seem able to find me a real person. Eventually I had to complain, and then I found someone to cancel the order. This was simply because it was so difficult to find a proper answer to a simple question.

It is a shame that customer service was so difficult but like many people, I can't face agents which are not programmed for nuance every time there is an issue. I reccomend others go with a real, in person service in their local area, even if it costs more - it's when there are problems that you need a real person in your corner. This company simply couldn't provide that reassurance.",20,25,20
16,3,164,359,"I have long believed that food is medicine. Modern food production means people are often far removed from what they eat and consume what will not serve them.
With a recent interst in avoiding ultra processed food - Ultra Processed People has sold over 100k copies in the UK alone -  I want to provide a place where families can learn about agirculture; how grains, fruit and vegetakes grow in the field, how to tend them, when they are ripe. Partnering with local farms, I want to build a weekend camping and cookery retreat where parents and children get connected to nuritients, learn to make simple, tasty nourishing meals, and rethink their relationship with food.
I have connections on farms, but I need equipment - tents, stoves, pots and pans, and so on. And a small marketing budget, targeting intiially the 2% of the population who are vegan, and working via social media to find those with an interest in holistic, no snake-oil, health.",32,32,38
