participant_id,task_num,word_count,time_spent,response,openai_score,qwen_score,xai_score
138,1,105,328,"Taking my first solo trip to Cedar Point was more than just an adventure- it was a milestone in my journey of self-discovery and independence. Navigating the park alone, feeling the thrill of the rides, and soaking in the vibrant atmosphere, I realized how empowering it is to venture out on my own. This experience taught me that I'm capable of creating my own joy and embracing new challenges. I'm proud of myself for stepping outside my comfort zone. I encourage everyone to learn to like spending time with themselves. It has been such a wonderful experience for me and I'm happy to give tips.",28,25,35
138,2,131,236,"Walking into olive garden feels like wrapping yourself in a cozy italian embrace. From the warm, friendly greeting at the dor to the comforting aroma of garlic and herbs, the atmosphere is inviting and relaxed. I ordered the five cheese ziti, a dish that promises a mielty, cheesy indulgence- and it did not disappoint. Each bite was a dreamy blend of flavors, perfectly balanced with a hint of zesty tomato sauce. The staff was attentive without hovering. After the delightful five cheese ziti, I couldn't resist trying the cannolis for dessert and they were nothing short of spectacular. The crispy perfectly fried shells encased a creamy, sweet ricotta filling that left me savoring every bite. It was the perfect ending to a fantastic meal, leaveing me dreaming of my next visit.",20,15,25
138,3,87,360,"Hey there! Imagine a world where anyone can unlock their musical talent with just a little guidance. That's exactly what my music lesson business offers- personalied, one-on-one lessons with expert teachers dedicated to helping students master their instruments. With a $10,000 investment, we can grow our team and reach more aspiring musicians, offering them a supportive and engaging learning environment. Your support will help us create a vibrant community where music education is both accessible and fun. Join us in transofrming lives through the power of music.",20,25,20
138,5,102,257,"Coming out as gay in a conservative town was a significant challenge that tested my resilience and adaptability. Despite encountering resistance and differing viewpoints, I remained committed to open communication and mutual respect. This experience taught me the value of building bridges with people who hold different perspectives. I engaged in respectful dialogue, sought common ground, and demonstrated empathy, which helped me cultivate strong, collaborative relationships. This journey not only strengthened my resolve but also enhanced my ability to work effectively in diverse environments. I took the initiative to foster understanding by engaging in open and respectful conversations with those around me.",28,25,35
139,1,134,187,"Last month, I ran my first marathon. I trained for six months leading up to it by eating clean, keeping to a training schedule and making sure I was getting the proper sleep and rest. When the day finally arrived, I was ready to go! The first ten miles were easy, but as I made my way mid-way it got difficult. I honestly considered giving up, but just as I was about to, I was reminded of how lucky I was and am to be able to run! So many can't and so many wish they could. Focusing on this, I was able to not only finish the marathon, but also speed up a bit, too! As I crossed the finish line, I didn't just celebrate completing the race, but celebrating resilience and gratitude.",28,25,25
139,2,115,276,"Last night, I watched The Death of A Unicorn with Jenna Ortega and Paul Rudd, which debuted earlier this year. For a dark comedy, I rate it a solid B. While it had it's humorous moments, it was also gruesome at times and hard to watch due to this. It was also sad to see a unicorn, an animal that is so beloved and mysterious, be treated so poorly. I will give the movie an A for effort for pulling together such a beautiful mythical creature into a dark gruesome coedy. The acting though, by Rudd and Ortega was excellent, as expected. The special effects were decent, and the setting for the movie was beautiful.",20,25,25
139,3,115,206,"I love gardening. I think it's a great physical and mental hobby that can last a lifetime and doesn't have an age limit. I'd like to start a business that teaches people of all ages how to garden, and tie this into sustainability and environmentalism. This would help people by creating a resource for learning to garden, in turn they learn how to grow their own food, and it's also a great way to help the environment by growing food in your backyard meaning less resources to get the food to the store (transporation = emissions = harming the air). The workshops would be both online and also have in-person hands on options as well.",24,25,30
139,5,126,237,"A significant challenge I've faced and overcome was supporting myself after college. I had an entry level job that paid a decent salary, but I also lived in a high cost of living city, so most of my pay went toward my rent in a safe apartment. I overcame living on a small budget by carefully budgeting my money, using up all the food I bought, which was bought on sale, and finding free or low cost activities for entertainment. After a few years, I was able to afford more by moving up within my company, but I kept to my budget conscious ways. This experience taught me valuable life skills such as resourcefulness and strategic planning which I continue to apply in my professional life.",15,15,15
140,1,112,331,"I wanted to share something that happened to me last week. I had a terrifying experience while cooking chicken in a frying pan. A lighter accidentally fell onto the stove, causing a sudden explosion that engulfed me in flames for a second. In that moment, I feared for my life. Thankfully, I escaped with only a minor burn on my arm and singed hair. But it was very scary indeed. It's a reminder of how things in life can go wrong in a split second, and it can all be over in a flash. We must remember that and be thankful to God that we are alive every minute of the day.",24,15,35
140,2,63,360,"Well, I have mixed feelings about this place. It was my first visit there, and I don't think I'll be going back. The food was ok, nothing special, but not bad. However, I have little to say about the service. She was polite, but forgetful, and didn't do things I'm used to at diners. I had to request a napkin, and had to",15,15,15
140,3,117,319,"Dear investor,

I'd like to share my new business idea that I believe could be very successful. It combines my current job as a crossword puzzle creator, where I sell my books on Amazon. If we had an AI that could create crossword puzzles based on a given list of categories and determine how to construct a puzzle with that list, it would save a significant amount of time. We'd be able to push out many more books, as today it takes weeks to create one. The app can then automate the process with human intervention. With your $10,000 investment, we can develop and launch this app in no time. What do you say?

Best regards,
Me.",28,25,35
140,5,124,303,"When I started working as a video editor at this new place many years ago, I was asked to use Adobe CS6 instead of Premiere Pro 2, which was more advanced and with which I was familiar. I knew there was a security camera in the editing room, so I opened CS6 and purposely showed how I was frustrated, in case I needed proof to show my boss that it was a stupid idea. In the end, after the play in front of the camera, I used Premiere Pro 2, and since he liked my edits so much, he never mentioned CS6 again. I worked there for 5 years and left when I was offered a better job elsewhere, which my boss couldn't match.",28,25,18
141,1,114,299,"Have you ever felt disappointed in someone to the point where you can't see them the same anymore? In these last few months, I've learned that ""family"" is not always really family. Just because someone is a blood relative doesn't give them a free pass to disrespect you and treat you like crap. You can choose to cut them out of your life if they're only bringing you drama and negativity. My ""uncle"" singled me out by unfriending me for no reason, and then gaslit me when I called him out for it. I've come to realize that it's a waste of my energy and time. Share your stories of disappointing family members below!",24,25,25
141,2,129,273,"I thought this bottle of Bai ""Zambia Bing Cherry"" electrolyte water would be enjoyable and hydrating. Besides the slightly medicinal smell and aftertaste, it didn't seem that bad...until about 10 minutes later when the CAFFEINE started kicking in. I had already just drank a medium iced coffee - I wasn't looking for another jittery jolt! After I started feeling like I wanted to blast off through the roof of my kitchen, I looked at the back of the label and saw the caffeine content in small print. Who would have thought they would put caffeine in water? Needless to say, I was disappointed and won't be buying it again. If you need a major boost for an important exam or a 5K marathon, this might be for you though!",32,25,38
141,3,138,324,"Have you always wanted to maximize your writing? Do you think it's better for a real person to help you rather than an AI that often can't tell the difference between a comma and a quotation mark? If that's the case, then Grammar Pro Services are for you! We will bring your writing to the next level with our 10+ years of experience in proofreading all kinds of writing. We recently helped an older adult returning to college for the first time in 30 years and taught him things he never knew about punctuation usage. Now he's equipped with skills that can carry him to success. We can do the same for you. Visit our website for more information and to get started! We can help you with academic writing, creative writing, business writing, and so much more!",20,25,20
141,5,168,347,"In my previous online 1-on-1 teaching job, I faced a significant challenge when I was assigned a student who had been out of school for months and was falling far behind his classmates. The pressure was on to catch him up and get him back on the road to success, and I was up for the challenge. I assessed his current skill levels for his grade and developed a unit plan to help him refine his research skills and draft an argumentative essay. He had some frustrations at times, but I maintained positive reinforcement and encouragement, and I helped him work through some of his challenges, such as crafting a strong, debatable argument and utilizing scholarly sources. I also set aside a few minutes at the end of each class for him to share updates about his hobbies and his other classes. Not only did he do well with the task, but it got him ready to return to his class as if he never missed a day.",20,22,25
142,1,139,181,Last winter I called up a few of my friends to take the weekend off and partake in a heliboarding experience on a random weekend to break free from their daily lives but also connect with one another but also allowed for a couple days to catch up. First challenging part was getting everyone the ability to take time off. Then i booked and paid for everything that way everyone would go and not feel like it would embed their life. Sol of courses they all joined and we had a spectacle time and finished with a relaxing time at the cabin the day before we all had to go back to our normal lives as that was the last time i spoke and have heard from them in the last decade and probably the next decade to come.,32,25,28
142,2,101,328,I watched a movie that was set in the 1950's but was portrayed from a 2025 perspective meaning robots and AI along with other technology that wasn't existed in the 1950s. The movie consisted of a strong cast and there was a specific moment that allowed for the 50's and 20s to correspond well which is when they depicted the technology to date effectively but also allowing for believability to exist upon executing the plot. All in all the movie was great to watch as it expanded the possability of events occuring with also the engagement of a 2025 debut movie.,20,25,35
142,3,105,152,Im passionate about people that are older who tend to be in there 50s who have experience a lot but not having anyone to talk to. Thus i have thought of using AI to be your companion and not only listen to you wants and needs but also reply back to keep them company and entertain them during there last remaining years to come. Thus solving the problem of feeling alone when you get older but also have someone to talk to we is not only interested but respected to hear what you have to say when its all done. AI for old age companionship.,24,25,38
142,5,106,144,I was at a recent interview when i was asked to speak about my weaknesses and quite frankly it seemed impossible as i do not tend to think that way but is always a hard time to come up with ideas on how im not either good enough or fail at something. Till the interviewer was nice enough to give me an example to go off of to help me get started. From there i was able to discuss a failure that i not only felt comfortable sharing but also felt happy about disclosing to them in the interview. So all in all it worked out.,15,15,15
143,1,194,336,"TIL why you don't use clip-top bottles for homebrewed sodas. I put together the ingredients for an elderflower soda, was super excited for it, and having put it all together I poured it into the bottles and promptly forgot about it for a few days. Not only did I forget it was there, I also forget when I put it there, so when I found it again I'd forgotten it had been gradually building pressure all this time. Delighted at finding this unopened soda, whose flavour I was eager to try out, I promptly took it to the kitchen, flipped open the cap... and BOOM! The blast went all the way to the ceiling before cascading back down onto anything and everything. Not my proudest moments.

*If* I had thought to use a plastic screw top bottle, I'd have noticed how rigid the bottle was and taken precautions, but with a clip-top bottle there's no warning about the ticking time bomb in your hands. So for all you amateur home-brewers out there, learn from my sticky escapade. 

P.S. Weeks later, I'm still finding little bits of dried elderflower in odd places in the kitchen.",44,42,42
143,2,185,334,"The Lost City, a 2022 romance movie that comes across as an existential crisis for Sandra Bullock, as she faces the prospect of aging out of Hollywood's acting age range for leading women, but she isn't ready to let go no matter how many botox injections it takes. 

She stars as someone who is burnt out, who hates he fans, who no longer feels any satisfaction from the media they produce. Wait, did I say ""stars?"" I should have said ""she is,"" because that's the vibe that comes across when watching this movie. There's half-hearted laughs, but with her wrinkle-free forehead she seems aloof to the trevails of her adventure. Attempts at romance are met with a blank eyed stare as her facial muscles struggle to compose any emotion. The leading man's energy attempts to compensate for this, and he is charming, but there's only so engagement you can get behind for a character who is in love with someone that doesn't seem to love them back. 

So too with this movie. I wanted to love it, but it doesn't want to love me back.",44,42,42
143,3,175,335,"Our lives are becoming more and more remote, remote work, remote friends, remote love life. While there are many ways to interact in a business or gaming context, the ability to share the smaller moments in life is being lost. For that reason, I want to try and fill some of that loss with VR, by integrating augmented reality so that partners can see themselves sharing dinner together even while they're leagues apart. Both partners would setup their VR environment with a table and a meal in front of them, with a 3d-capuring camera pointed at them from the other side of the table, and they'd project their image to one another. This way they can enjoy their meal with company, prompting the idle little casual chats which are the heart of any intimate relationship and for which we sometimes forget to make time for. 

The software could also sell DLC for more exotic backdrops for the couple to enjoy while sharing their meal, turning it from a night in to a fancy night out.",40,38,42
143,5,149,360,"Being a heavy computer user, I tend to notice small slowdowns or changes in behaviour. In one such instance, after installing some project management software, I noticed such a slowdown. I noticed the hanging seemed to occur most frequently whenever my internet connection became erratic, and so I wondered if perhaps the software was reporting usage information back to its servers. Checking netstat, I could see there was a connection being established, but I wasn't sure what it was sending. Suspicious about its need to ""phone home,"" I setup my own DNS server that spoofed the website so that my computer would send packets to a secondary computer, which then relayed it to the server, so I could then monitor in real-time exactly what messages were being sent back and forth. Sure enough, the software was sending fairly extensive usage reports, which I swiftly put an end to and",44,25,15
144,1,82,208,"This year, our family got together to celebrate my sister's--and her new husband's--new life journey: marriage. It was only yesterday my sister and I were frolicking in our parent's backyard and collecting Pokemon cards. I got to see my sister walk down the aisle with all our family gathered together to witness this special occasion. Despite the chaos that happened prior to the wedding, my sister and her new husband pulled off their special day with flying colours. Congrats Jane and Bob!",20,25,20
144,2,67,148,"I recently attended my local slot parlor to play popular slot machine games like Huff N' Puff and Lucky Ox. The slot parlor had attentive and friendly staff who went around the gaming floor asking people if they would like complimentary coffee. Despite not being a full-scale casino, the slot parlor provided me enough entertainment for a few hours with its diverse offerings of slot machine games!",20,15,15
144,3,96,317,"In North America, over 40% of seniors report feelings of loneliness. This contributes to complicating health issues like depression and heart disease. On the other end, millions of loving and loyal pets are surrendered to shelters every year. Countless dogs and cats are displaced, confused, and are often residents of kill shelters that are overcapacity. My goal is to bring lonely seniors and abandoned pets together. We operate using a mobile network of pet handlers to bring pets to senior care homes across the city on a weekly basis to accompany, socialize, and keep seniors company.",28,35,42
144,5,98,239,"I was assigned a task to assemble multiple PDFs of deliverables for a client that outlined their clinical data using Adobe Acrobat. This was my first time using Adobe Acrobat for this purpose, so the deliverables took longer than I initially anticipated. At the same time, this task was urgent and had to be delivered in 3 days. I dedicated extra time after work to finish the deliverable on time, working a few extra hours on the weekend. As a result, we submitted the task on time to our client, which was polished and perfect, with no errors.",15,15,15
145,1,105,358,"Watching football when you are English is known to be one of the most stressful things you can experience in life, right up there with moving house or getting divorced. There's not many situations that can transform me from chilled Sunday vibes to screaming like a character straight out of Eastenders, but this was me during the match. The fouls, the near misses, the oh my god what if this goes to penalties. And then it went to penalties. I was sweating. My heart was flying out of my chest. And then that final penalty, made my heart beat to the tune of Sweet Caroline.",36,38,38
145,2,70,360,"So I tried Lemonade bras for the first time and oh my god! I bought a few different styles because I wasn't sure what I would like best, and as they were in the sale it was very enticing. I like that there are no underwires because honestly whoever decided actual metal wire would be helpful in supporting delicate tissue really must have had a bad childhood. I also appre",28,25,35
145,3,114,331,"PenguinBites is going to take the pet food industry by storm. Before you panic, no, we are not going to be feeding bits of penguins to your cats. Rather, we are going to do something absolutely brand new. We are going to sell food for pet penguins. 'But no one even has pet penguins', I hear you say. Well, it might not have occurred to you but the biggest obstacle to penguin pet ownership has, until now, been a lack of availability of food for penguins. But we will be the first. And yes, probably the last. But let's dive in and make a splash together for the future of the pet food industry!",44,45,42
145,5,116,348,"A significant challenge I have faced is frequent diarrhoea. In case you don't know it, diarrhoea is when the actual world falls out of you, from a place you'd rather not have to think about too often. 

One of the things I have learnt is how to think fast in order to make up quick excuses as to why I am needing to avoid someone. This is useful in a work environment because thinking on your feet can really help the team in times of urgency. 

Another thing I have gained from this is knowing I can survive times of extreme embarassment, and perhaps even have some good anecdotes to tell should the occasion be needed.",40,42,15
146,1,99,162,"A few months ago, my whole world changed I became a dad to a baby girl. 
It’s hard to put into words what that moment felt like… pure love, deep responsibility, and a kind of happiness I’ve never felt before.
The late nights and early mornings are real, but when she looks up at me or grabs my finger, nothing else matters.
Becoming a father has made me stronger, more patient, and more grateful than ever.
I’m excited (and a little nervous) for this new journey, but I know she’s already the best thing that’s ever happened to me.",24,25,30
146,2,108,141,"I recently visited Grand Indian Lounge with my wife, and we both had a really good experience. The atmosphere was calm and cosy — perfect for a relaxing dinner. The staff welcomed us warmly and made us feel comfortable right away.
We ordered chicken Jalfrezi, lamb rogan josh, garlic naan, and pilau rice — everything came out hot, fresh, and full of flavour. The spices were well balanced, and the portions were generous too.
What stood out most was the service — friendly, respectful, and not rushed.
If you enjoy proper Indian food and a peaceful setting, I’d definitely recommend trying it. We’ll be going back for sure!",18,15,15
146,3,106,90,"I want to start a business called Refillably – a smart refill station for everyday items like shampoo, detergent, and soap. People can bring their own bottles and refill just what they need, helping cut down plastic waste. It’s simple, eco-friendly, and cheaper in the long run.
I’d place the machines in busy places like supermarkets or flats. An app will track refills, give rewards, and show how much plastic people save.
With $10,000, I’ll build a working prototype, develop the app, and launch a test run in a local store.
This idea can help people save money and protect the planet at the same time.",32,25,38
146,5,106,156,"A challenge I faced was working under pressure in a job where we were short-staffed, and I had to take on extra responsibilities I wasn’t trained for. At first, it felt overwhelming, and I didn’t want to make mistakes. But instead of backing off, I stayed calm and focused.
I took time to learn quickly, asked experienced staff for advice, and made sure to stay organised. I kept a positive attitude even when things got stressful. In the end, I managed to handle everything well, and the team appreciated my effort. That experience helped me grow in confidence and showed me I can handle difficult situations.",15,15,15
147,1,109,278,"Okay so one of the best things that has happened to me in the last few months was this random trip that me and my friends took. We did not plan it at all we just threw some clothes in a bag and drove like 4 hours to a lake we saw on tiktok. There was no cell service and a sketchy gas station. We swam, made a camp fire, and just laughed the whole time. It felt really great to forget about everything for a little bit. Honestly, I needed that more than I realized. I think it was one of the best trips i have ever had.",24,25,35
147,2,104,333,"I watched Inside Out 2 a few weeks ago and honestly, it was way better than I expected. I thought it might just be a copy of the first one , but they actually added new emotions and it made things feel fresh. There were parts that were super funny and then out of nowhere, it hit me right in the feels. The animation was awesome too. If you liked the first one, you will probably like this one even more. It is one of those movies that makes you laugh and think at the same time. I would watch it again for sure.",20,25,25
