participant_id,task_num,word_count,time_spent,response,openai_score,qwen_score,xai_score
199,1,102,341,"Just a couple of month ago, I found myself hiking at sunrise in a national park. The crisp morning air filling my lungs as the first light painted in the sky with hues of pink and gold. The view was wonderful and breathtaking, the mountains stretching endlessly under the sea of clouds. The moment was very pure and overwhelming, reminding me of the beauty of nature and the peace in brings to our busy lives. That morning, surrounded by nothing but silence and splendor, i felt so alive by the wonders nature has offered to me and the rest of the world.",28,25,28
199,2,101,273,I recently bought a mobile device but  at first i was not sure it was worth it. One day i was going through the device and i saw a hidden settings where all the tools i need was stored and i was so amazed. I later reached out to the vendor i bought the device from and render an apology for the complaint earlier. From that day i cherished that device like no other device. This thought me a lesson about patience and this made my life more better than it was. I was convinced that life is full of surprises.,15,15,15
199,3,82,359,"Introducing GreenLife, an innovative urban farming initiative transforming vacant city rooftops in lush, sustainable gardens. Our mission is to combat urban food deserts by providing fresh, organic produce directly to local communities, reducing carbon footprints and improving healthier lifestyles. With your investments, we will expand our reach, develop educational programs, and employ cutting edge technologies to maximize yield and efficiency. Join us in revolutionizing urban agriculture and building greener cities. Invest in GreenLife and watch your contribution sky rocket in many w",28,25,38
199,5,88,354,"In my previous role, I led a team to deliver a critical project on a tight deadline when two important member left the company unexpectedly. I rapidly checked our resources, dished out tasks, and initiated cross-training sessions to fill the empty space of the members who had left. I also implemented daily check-ins to maintain open communications and ensure alignments. Despite the initial setbacks, the team pulled together and delivered the project on time, and received recommendations from our clients. This experience taught me the importance of adapabilty",15,15,15
200,1,143,350,"Hey Everybody!

This post is for all you gardeners out there. 

As a gardeners myself, I grow my own food as well creating a healthy habit for animals and wildlife to thrive. Recently, I came across a book on Bonsai trees. Now, although this topic does not really fit in with gardening per se, I was fascinated with the artistic side of crafting the Bonsai tree. 

It could be argued that partaking in such an activity is like going against nature, and before I began, I probably would have said the same thing.

But here's the rub. It combines being a gardener and being an artist so well that the two become one. So much so that it has been a more rewarding experience than just being a gardener.

So, I would say give it a go and let your green artistry shine!",28,25,35
200,2,231,329,"My thoughts on the recent I Know What I Did Last Summer remake.

First of all, I enjoy the first to films in this franchise. They are not the greatest films in the world by any means but this is where the 90s it-cast has its sway. Jennifer Love Hewitt, Sarah Michelle Geller and Freddie Prinze Jr are so magnetic that you can’t help but enjoy these early romps – falls and all. 

Fast forward nearly three decades later and the magnetism is totally dead. The new cast are z-listers who have no charisma or charm. It doesn't help that they, as well as the whole film, are terribly written. 

The original cast do show up but when they do, they are a shadow of the characters that they were playing decades ago. It would have been better asking them to play different parts. And the end is just ridiculous and undoes a major character's arch from the first two films. Maybe the worst thing about it is that it isn't even scary and has zero tension.

This is a remake that no one was asking for. It should not have been made and the only reason it has been made is to make money!

I would say don't both seeing it in cinemas. Wait for it on streaming or when it airs on TV. 

Total and utter waste of time.",20,25,20
200,3,205,356,"Our planet is in trouble. 

As each year rolls on, pollution is causing air quality issues, plastic waste is polluting our seas, corporate greed is demolishing rainforests and a lack of government action is causing people to loose their faith in the people they vote for. 

People are sick of seeing rising temperatures while nothing is done about it.

People are sick of billionaires throwing their weight around like the own the world and watching them destroy it for their own financial benefit. 

People are sick of seeing animals suffer and lose their homes and habits to greedy businesses who do not have a care in the world about the destruction that they are causing. 

I say that the time for protesting is over!
I say that it is time for action!
I say that if you provide me with you $10,000 investment, I will organise a daily local workshop for anyone interest to help in the fight to end climate change. This will involve a range of activities that will help flip the switch on climate change such as planting trees, educating people to grow their own food and making governments to take action.

So, what do you say?
Go Green Or Go Home!",20,25,30
200,5,266,342,"When I was doing my dissertation at university, I chose a topic that I was knowledgeable about and that I had a lot of interest in. I was so excited get started and I was certain that I was going to produce a very high quality body of work.

However, when I began researching the topic, I realised that I might have bitten more than I can chew. There were so many aspects of the topic that I didn’t consider. There were certain moral implications that could go against my standing if I messed this up which added to the pressure and stress of the situation. Also, the area was much more complex and involved an incredible amount of time to shift through the realms of data that was out there.

Once I realised what I was up against. I seriously considered axing this idea and focusing on an area that was easier to work on. But then, I took a step back and remembered that the reason that I approached this topic was for my interest and passion for it. And now after I had done some research and found out that is was going to be tougher than I thought, I was going to run away.

This did not sit well with me. So I took a day to clear my head and then the next day, I started working on the topic and continued to do so day and night for months until I finished and submitted it.

After a few weeks, I got my results back and I received the top grade.",20,25,15
201,1,100,357,"I just had an unforgettable day at the zoothat was nothing short of magical. As I wandered through the lush pathways, a playful littl monkey caught my eye, mimicking the crowd with cheeky gestures. The higlight was the lion's roar, echoing through the air and sending chills down my spine. Watchingthe penguins waddle in their tuxedo like splendor borught a smile to my face.If you have not visited a local zoo lately, I highly recommend it for a day filled with wonder and discovery. Every animal encounter reminded me of the world nice nature to be thankful of every day.",20,25,20
201,3,101,326,"I would consider launching a subscription based platform that connects the local artisans with consumers seeking unique ,handcrafted products. This platform could highlight the stories behind artisan, forstering a community of buyers who value craftsmanship and sustainability potentially appealing to investors interested in supporting small businesses and local economies. Imagine it being a virtual reality marketplace where users can explore a digital artisan village, iinteracting withh craftsmen in real time to watch the creation process and customize their own unique products. This immersive experience not only supports small artisans but also offers a novel and engaging way for consumers to shop.",40,35,42
202,1,85,282,"I was so close to what i would call my idol and inspiration the other day Cristiano Ronaldo which made my heart beat like when i first saw him withered in red playing for manchester united and this time representing his country he reminded me of why i am inspired by him by showing us his amazing skills and determination,
an amazing and unforgettable experience which i will never forget and will always remind me of his greatness.
G.O.A.T Cristiano Ronaldo the one and only!",20,15,20
202,2,100,319,"i went to the cinema with my girlfriend recently to watch lilo and stich and we had such a great time as the movie just reminded us so much from our childhood and we couldn't stop our laughs and happiness during the movie.Every scene being played just reminded us of our childhood and we had missed that feeling so much so we both were very happy we went to see that movie which was excellent by the way.
If you would like to revisit your past and childhood memories i would definetely recommend for everyone to go and see it.",18,12,15
202,3,97,296,"hello and welcome to andi's coffee shop here at andi's we like to give a family feeling experience and we do that by serving homemade desserts and also we serve the best coffee in town and plus the beautiful atmosphere and cozy feeling you will get as soon as you will enter our shop make up for the best coffee shop experience you will have in your life.Join us in what we call home and have an amazing experience.
dont forget to bring your smiles and your wallets all the rest will be provided by us haha",18,15,15
202,5,113,261,Working as a supervisor i have faced quite a lot of different challenges and one of them that i remember was that there was this one time where i faced a last minute staff shortage and i had to quickly find a way to resolve that and thus what i did is that i reorganized my team and also i jumped into various positions myself so we don't face an issues with the shortage and not only we managed to thrive and overcome that but our efforts were rewarded when our manager congratulated me on my quick thinking but also the rest of the team for their hard work and willingness to help.,20,15,15
203,1,127,359,"Last week, a simple and routine walk to the park turned into something I would never have imagined. A reconnection with a childhood friend I had lost contact with for years.
I always take some time to visit the oark with my kids, but on this very day, i walked into a dear friend that I've known since childhood, we practically grew up together, attended same elementary and secondary school and were best friends for most part of our early lives, until we went to different Universities and then lost contact, what's more surprsing is that she had just moved to the neighborhood and just like myself, always liked to take a walk in the park with her daughter. and that's how fate brought us back together.",28,25,25
203,2,105,359,"I recently saw the movie G20 and it was good seeing a Black Female President of The United States in action, In fact, I can say it was inspiring, and Viola Davis did a great job bringing the Character to life with her grit and strenght and incredible acting. while the movie was action packed, I still feel the movie focused more on showing her as a woman rather than as the most powerful Human in the world, some of her actions could have been better and goes to show that even despite being the president, her being a woman still comes in the way.",18,25,20
203,3,93,359,"Growing from a lower middleclass home, we didn't always have enough to eat and this always made me fantasize about the different things I can do to make sure we had more than enough food.
This made me gain  a lot of interest in agriculture and food production.
 Food insecurity remains a major issue in many communities and my agrobusiness aims to tackle that by producing affordable high yield crops for these communities that need them the most.
investors can expect a return of 20 - 25% return within the first two years.",20,28,25
203,5,16,359,"When I started at my new role, i got assigned a role I was not rea",10,10,10
204,1,124,360,"One unforgettable morning this past summer, I set out on a kayaking adventure just before sunrise. The world was still wrapped in twilight and a delicate mist hovered over the lake, creating an ethereal atmosphere that felt like stepping into a dream. As I paddled silently, the horizon began its slow transformation, with the first light of dawn igniting the sky in breathtaking shades of orange and pink. The tranquility of the water mirrored the vibrant colors, and I was struck by the profound beauty surrounding me. In that moment, I reminisced on my life's journey and all the turbulence I have had to overcome to get to this moment of my life where I now have the privilage to enjoy this peaceful moment.",34,28,42
204,2,105,360,"Last weekend I visited ""The Rustic Fork"", a cozy Italian bistro nestled in the heart of downtown. The ambiance was charming, with dim lighting and rustic decor that made me feel like I had stepped into a Tuscan villa. I started with their bruschetta, which was perfectly crisp and heaped with fresh tomatoes and basil. For the main course, I couldn't resist the handmade fettuccine Alfredo. The pasta was silky and was cooked to perfection. In all I would rate this restaurant very highly and say it is a 8/10 because the service was also good. My only downside is that it was quite pricy.",20,15,20
204,3,64,359,"Imagine a future where every home in sub-saharan Africa has a reliable clean energy without noise and pollution of petrol generators. By investing $10,000 in our microgrid initiative, you are not just funding electricity, you are empowering communities with sustainable power, forstering economic growth, and improving quality of life. Let's light up neighborhoods with greener more efficient solution and create a brighter future together.",24,25,35
204,5,100,359,"At my previous jib, I led a project to develop machine learning models that significantly reduced cheese waste in our manufacturing process. By analysing production data and optimising workflows, we decreased waste by 30%, which not only improved efficiency but also contributed to sustainability goals. While this was a difficult task, it enabled me to challenge myself in providing the best solution to the problem and also I learnt how to manage different stakeholders in such process from the factory workers to the data science team and wewere all able to achieve a common goal working together in this project.",24,25,15
205,1,82,318,"Just visited the new art exhibition downtown and was absolutely blown away by the vibrant and immersive installations! The blend of modern art with a touch of local culture made the experience truly unforgettable. The artists' use of colour and interactive elements kept me engaged at every turn. If you are looking for an inspiring and creative afternoon, this exhibit is a must-try. Just beware of the weekend crowds, as it can get quite busy, but it is definitely worth the visit.",22,15,30
205,2,73,359,"Stepping into this restaurant felt like entering a warm embrace. The rustic wooden tables and softly glowing lanterns created an inviting atmosphere perfect for a relaxed evening. Our server was attentive without being intrusive, offering helpful suggestions with genuine enthusiasm. The star of the night was the herb-crusted salmon, beautifully presented and bursting with flavour. While the dessert menu was limited, the chocolate lava cake was a delightful finish. The only dwnside was",20,15,25
205,3,66,359,"Imagine a world where sustainable living is not just an option, but a seamless part of everyday life, Our company, EcoEase, is one on the brink of revolutionising home energy consumption with our innovative smart eco devise. Thesea devices learn habit to optimise energy use, significantly reducing both cost and carbon footprints. With your $10,000 investment, we will enhance our prototype and launch a pilot progra",24,35,35
205,5,40,360,"In my previous role, I faced the challenge of coordinating a major project with a tight deadline and limited resources.

By transforming prioritising tasks, fostering teamwork, and implementing creative problem-solving, I successfully delivered the project on time, exceeding client expectations.",15,15,15
206,1,19,359,"Reflecting on my brother's wedding earlier this month, and my heart is still full! The day was a beautiful",20,15,15
206,2,77,353,"Upgrading from a 10kg to a 15kg washing machine felt like trading my trusty sedan for a sleek sports car. Suddenly, laundry day turned into a breeze as I effortlessly tackled larger loads in record time. Not only am I saving precious minutes, but my wallet is thanking me too with reduced energy and water bills. If you're looking to streamline your laundry routine and enjoy some extra free time, this upgrade is a game-changer worth considering.",28,25,30
206,3,72,327,"Imagine a tour company that transforms travel into a series of unforgettable stories, connecting adventurers with hidden gems and local cultures in ways they've never experienced before. With your $10,000 investment, we can bring this vision to life, creating unique, immersive experiences that leave a lasting impact on our travelers and communities alike. Join us in revolutionizing the way people explore the world, and let's turn every journey into a cherished memory.",24,25,30
206,5,56,313,"Facing the loss of my newborn was the most profound challenge of my life, leading me to take a year off to heal. During this time, I rediscovered my purpose and resilience, which not only helped me pursue my dreams with renewed vigor but also strengthened my ability to face future challenges with empathy and determination.",24,15,35
207,1,41,359,"Early this year, my wife and I embarked on a magical journey to France, where Paris stole our hearts with its enchanting charm. From cruising along the Seine to soaking in the breathtaking skyline, every moment was a dream. #ParisGetaway #SeineCruise",20,25,20
207,2,45,360,"As a lifelong Apple enthusiast, I never thought I'd be tempted to switch teams, but the Samsung Galaxy S25 Ultra has me reconsidering. This phone is a masterpiece, with a sleek design that exudes sophistication and a camera that captures every moment in  breathtaking detail.",20,25,15
207,3,75,359,"Introducing ""SoupSavvy"" -- the future of canned soups, where convenience meets gourmet quality. Our mission is to transform the ordinary soup aisle with chef-inspired recipes crafted from organic, locally-sourced ingredients, offering, offering a nutritious and delicious experience in every can. By investing in SoupSavvy, you're not just funding a product, you're joining a movement to redefine comfort food with sustainability and culinary excellence at its core. Together, let's make every meal a moment to savor.",24,25,35
208,1,34,360,The recent school sports day was unforgettable! Watching my son guard the goal like a pro and lead his team to victory was pure joy. Proud doesn't even begin to cover it! #GoalkeeperHero #ProudParentMoment,20,25,20
208,2,31,359,"If you're in the market for new headphones, the Alienware Pro headsets might just be your next best buy. They're wireless and charge super fast, plus the noise cancellation and high-resolution",20,15,15
209,2,101,282,"I recently watched Superman at the cinema and I really enjoyed it. The movie was really hopeful and inspiring and fun, something often missing from modern super hero movies. I thought the plot was interesting and the performances from all the actors were great. I particularly liked the soundtrack and the fun that it brought to the movie. I thought the costume design was cool and worked for a lot of the really interesting characters. The performance from Nicholas Hoult was especially good as a really convincing villain as Lex Luthor. I also liked the political aspects and themes and messages.",18,12,15
209,1,102,171,"A memorable experience from the past was when I went to Whitby for a little weekend away with my friend. I remember going to a beach and swimming in the sea. It was really cold, honestly freezing but it was really fun and I had a nice time. I remember feeling quite cozy on the beach with our blankets and it was really calming and peaceful to stare out at the sea. I remember the waves kept coming in and they were pretty consistent, it was cool to see how powerful the ocean was and in a way I felt really small.",20,22,25
209,3,101,160,"I would want to start my own bakery company, focusing on British ingredients and reducing food waste. I would start with classic flavours like rhubarb and blackberry, starting with fresh ingredients. I would make products like crumble bars and would originally focus on sweet baked goods before moving on to savoury. In terms of reducing food waste I would utilise commonly wasted food products to use in my recipes, such as using leftover broccoli stems to create healthy, tasty savoury muffins. I would try my best to use seasonal ingredients, creating a range of products that change from season to season.",28,25,28
209,5,100,141,"A challenge I faced at work was in terms of creating fun craft activities whilst managing a small budget with only limited resources. This required me to use my creativity and resourcefulness. I did this by keeping a log of the resources we had. I also looked at how many activities we needed to plan. Using my creative skills I was able to plan different themed activities within the budget and with the resources we had to keep the children engaged. I managed to create a thorough programme of activities that the children enjoyed, overall it was very successful overall.",20,15,20
210,5,47,101,"In my last job I had many critical projects with tight deadlines and that were key to the performance of the company as a whole. I excelled by remaining calm, producing clear achievable small tasks and implementing a new project management tool that helped greatly with organisation.",15,15,15
210,3,70,179,"Ever since my gran died of Alzheimers, my passion has been to raise money for research and care for the disease. My charity startup aims to massively raise awarness, research and direct support in the area. There are obviously lots of noble causes to raise for, bit studies show Alzheimers is the most underfunded disease in the western world today.Today I ask for 10k to help fuel a desperate need.",18,25,15
210,2,50,112,"Watching haloween for the first time made my skin crawl in tenion and suspense. What a fantasticly made and original film, that has stood the test of time. A must see for horror fans or anyone who wants to be spooked! Think you arent afraid of horror movies, think again!",20,15,15
210,1,35,80,"Attended my first ever pottery class last week and what a beautiful mess it was! I ended with my head, shoulders, hands and toes covered in clay and my pride morphed into a floppy lump.",34,38,38
212,3,83,293,"My dream is to create a my own toy brand that represents soft feminine cuties of all backgrounds with sass and charm. Inspired by Popmart, but with my own art style, that includes curves, cute expressive faces and adorable packaging. With that 10k, I would scale production, create professional molds, launch limited drops, and open an online shop that represents my imagination fully. I already handmake my prototypes and post previews online and have the support. I would call the toyline, Chibi Charmers.",28,35,38
212,5,73,360,"As a freelance artist, I didn't have the cushio of a steady paycheck or resources, just a deep passion for creating art that reflects women like me who are curvy, artistic, confident. Early on, I struggled with self-doubt and burnout/pressure to be ""productive"" while still managing my chronic pain and mental health. I couldnt afford fancy tools or programs, but I used what I had and made it to where i am now.",24,25,30
212,2,106,267,"After watching Squid Game, It was intense but so good. The colors and sets were super cool, like a twisted kid's game world. It had deep messages about money, survival, and trust. Some parts were hard to watch but I couldn't stop. The story pulled me in and the characters made me cry. I'd recommend it if you like dark thrillers with meaning. Also the music in the show enhances the tension and atmosphere. The pacing of the show is easy to follow but not too slow, you get good screen time of the lead and get to understand his backstory and emotions towards certain situations.",20,15,25
212,1,100,188,"A few months ago, I sculpted my first chibi figure from clay, just me, music, and a messy table. I didn't know what I was doing, but I felt so alive. Her name's Lulina, and she turned out way cuter than I expected, flaws and all. Since then, I've been dreaming of making a whole collection, little sisters, stickers, even packaging. It's wild how one messy project became a full on passion. Resin fumes, sticky fingers, and tiny paintbrushes later. I feel like a I found a new part of myself. Can't wait to see where this magic goes next.",38,38,42
